{
    "$schema": "https://blend-backend-staging-2oyuucbkoa-uc.a.run.app/schemas/blend-config.json",
    "brand": "test/branch",
    "theme": "light",
    "output": "src/blend",
    "components": [],
    "studio": {
        "apiUrl": "https://blend-backend-staging-2oyuucbkoa-uc.a.run.app",
        "autoSync": false
    },
    "generate": {
        "typescript": true,
        "cssVariables": false,
        "reactNative": false
    }
}
