{
    "$schema": "https://blend-studio-staging-2oyuucbkoa-uc.a.run.app/studio/schemas/blend-config.json",
    "brand": "blend/default",
    "theme": "light",
    "output": "src/blend",
    "components": [],
    "studio": {
        "apiUrl": "https://blend-studio-staging-2oyuucbkoa-uc.a.run.app/studio",
        "autoSync": false
    },
    "generate": {
        "typescript": true,
        "cssVariables": false,
        "reactNative": false
    }
}
